{
  "action": "extract",
  "configuration": {
    "angular_deflection": 0.5,
    "brep_format": "occt-ascii-brep-7.9.3",
    "healing": {
      "enabled": false,
      "maximum_tolerance": 0.001,
      "minimum_tolerance": 1e-07,
      "precision": 1e-07
    },
    "linear_deflection": 0.1,
    "schema_profile": "acx32-xde-v1",
    "tessellation_units": "source",
    "xde": {
      "colors": true,
      "layers": true,
      "materials": true,
      "names": true,
      "placements": true,
      "units": true
    }
  },
  "configuration_digest": "b35d968bfcf1c6efb6c025600417fb35e55a501abe6364a3d01dbc28d14a519e",
  "input": {
    "bytes": 16892,
    "path": "input/cc1c9e3cdb0799fd2e602edb533f30051a0ea47db45ed9c0fd84dcd892498c61",
    "sha256": "cc1c9e3cdb0799fd2e602edb533f30051a0ea47db45ed9c0fd84dcd892498c61"
  },
  "limits": {
    "cpu_seconds": 60,
    "max_decompression_ratio": 20.0,
    "max_files": 20,
    "max_input_bytes": 10000000,
    "max_memory_bytes": 1073741824,
    "max_open_files": 32,
    "max_output_bytes": 20000000,
    "max_records": 100000,
    "max_recursion_depth": 64,
    "wall_time_seconds": 60.0
  },
  "protocol_version": "0.2",
  "provider_id": "org.aecctx.step-iges.ocp",
  "request_id": "55bd46fec4910805b163b1ddb2109c3bd4f6da359ab11bf227bef8e9714a7edb"
}
