{
  "action": "extract",
  "configuration": {
    "angular_deflection": 0.5,
    "brep_format": "occt-ascii-brep-7.9.3",
    "healing": {
      "enabled": true,
      "maximum_tolerance": 0.001,
      "minimum_tolerance": 1e-07,
      "precision": 1e-07
    },
    "linear_deflection": 0.1,
    "schema_profile": "acx32-xde-v1",
    "tessellation_units": "source",
    "xde": {
      "colors": true,
      "layers": true,
      "materials": true,
      "names": true,
      "placements": true,
      "units": true
    }
  },
  "configuration_digest": "37eed6eebbfe687d510400533f99e61c53aae914775e3f5e20577e534cb0b4cf",
  "input": {
    "bytes": 34615,
    "path": "input/d5c28c62920f082c5e3de992ed7ed7d151a38fb31887ead01c338210b0c2e1e2",
    "sha256": "d5c28c62920f082c5e3de992ed7ed7d151a38fb31887ead01c338210b0c2e1e2"
  },
  "limits": {
    "cpu_seconds": 60,
    "max_decompression_ratio": 20.0,
    "max_files": 20,
    "max_input_bytes": 10000000,
    "max_memory_bytes": 1073741824,
    "max_open_files": 32,
    "max_output_bytes": 20000000,
    "max_records": 100000,
    "max_recursion_depth": 64,
    "wall_time_seconds": 60.0
  },
  "protocol_version": "0.2",
  "provider_id": "org.aecctx.step-iges.ocp",
  "request_id": "bb4658b66c4f78ba4ab47625ff336e344e60c76ee784025f2ee2b8284b5c1ec0"
}
