{"action":"extract","configuration":{"dpi":300,"minimum_confidence":0,"ocr_profile":"spa-block-v1","orientation_degrees":0},"configuration_digest":"22c8bce2868be4dfcc7e1b7531271ca0bced49e389cc7511e189af0b000ada72","input":{"bytes":216015,"path":"input/f4d1715b0d25b704173b7e5d6e743f5a7e7d3afa8109eb559f523582bc12a4aa","sha256":"f4d1715b0d25b704173b7e5d6e743f5a7e7d3afa8109eb559f523582bc12a4aa"},"limits":{"cpu_seconds":30,"max_decompression_ratio":200.0,"max_files":1000,"max_input_bytes":536870912,"max_memory_bytes":2147483648,"max_open_files":64,"max_output_bytes":67108864,"max_records":1000000,"max_recursion_depth":64,"wall_time_seconds":30},"protocol_version":"0.2","provider_id":"org.aecctx.ocr.tesseract-tsv","request_id":"9b4384123ae61de7d0d6de3b6ea0d53a5c5709586c81ae6fac84063424343b26"}
