{"action":"extract","configuration":{"emit_reconstruction":true,"foreground_threshold":32,"maximum_candidates":128,"minimum_component_pixels":5},"configuration_digest":"1da53892462a26c028653e894ad75bfa8b1ca8ec021cbcb4679d0e46f4fe3631","input":{"bytes":12302,"path":"input/1ee979b4eab1a50c1266f5c0547ceabc1c39610c03e48e9eebd46c9b9ba1fd61","sha256":"1ee979b4eab1a50c1266f5c0547ceabc1c39610c03e48e9eebd46c9b9ba1fd61"},"limits":{"cpu_seconds":30,"max_decompression_ratio":200.0,"max_files":1000,"max_input_bytes":536870912,"max_memory_bytes":2147483648,"max_open_files":64,"max_output_bytes":67108864,"max_records":1000000,"max_recursion_depth":64,"wall_time_seconds":30},"protocol_version":"0.2","provider_id":"org.aecctx.vision.raster-rules","request_id":"da73511d134b8997b04ada20262ce1b26ffd55f8df0addf4d00aaba1d3e1685d"}
